{
  "schema": "creative_brief/1",
  "artifact_id": "ART-BRIEF-001",
  "version": 1,
  "source_request": "미래적이고 세련된 AI 기술 매거진을 만들어 줘.",
  "topic": "AI technology and society",
  "purpose": "inform_and_inspire",
  "target_audience": "technology_interested_readers",
  "language": "ko",
  "tone": [
    "intelligent",
    "forward_looking",
    "accessible"
  ],
  "publication_format": "pdf",
  "page_size": "A4",
  "issue_length_pages": 16,
  "visual_direction": "미래적이고 세련된",
  "constraints": [],
  "ambiguities": [
    {
      "question": "실존 인물 인터뷰가 필요한가?",
      "material": true,
      "default_assumption": "가상 인터뷰로 하고 가상임을 표시한다.",
      "answer": null
    }
  ],
  "requires_factual_research": true,
  "approval": {
    "status": "approved",
    "approved_by": "user",
    "at": "2026-10-09T06:00:00Z"
  }
}
